{
  "as_of": "2026-09-02T12:00:00Z",
  "contract_version": "1.0.0-alpha.1",
  "generator": {
    "name": "egohygiene/observatory:organization-health",
    "version": "0.1.0"
  },
  "organization": "egohygiene",
  "repositories": [
    {
      "assessment": {
        "conformance": {
          "check_ids": [],
          "counts": {
            "blocked": 0,
            "fail": 0,
            "not_applicable": 0,
            "partial": 0,
            "pass": 0,
            "stale": 0,
            "unknown": 0
          },
          "reason": "no required evidence assesses this dimension",
          "rule": "required checks only; precedence is fail, blocked, stale, unknown, partial, pass, not_applicable; no numeric score",
          "status": "unknown"
        },
        "maturity": {
          "check_ids": [],
          "counts": {
            "blocked": 0,
            "fail": 0,
            "not_applicable": 0,
            "partial": 0,
            "pass": 0,
            "stale": 0,
            "unknown": 0
          },
          "reason": "no required evidence assesses this dimension",
          "rule": "required checks only; precedence is fail, blocked, stale, unknown, partial, pass, not_applicable; no numeric score",
          "status": "unknown"
        }
      },
      "declared": {
        "lifecycle": "incubating",
        "maturity": "light-foundation",
        "source": "Hygiene repository catalog"
      },
      "evidence": {
        "check_count": 0,
        "checks": [],
        "earliest_observed_at": null,
        "freshness": "unknown",
        "latest_observed_at": null,
        "producers": [],
        "record_count": 0,
        "represented_commits": []
      },
      "repository": {
        "full_name": "egohygiene/.github",
        "name": ".github",
        "plane": "architecture-control",
        "url": "https://github.com/egohygiene/.github",
        "visibility": "public"
      }
    },
    {
      "assessment": {
        "conformance": {
          "check_ids": [],
          "counts": {
            "blocked": 0,
            "fail": 0,
            "not_applicable": 0,
            "partial": 0,
            "pass": 0,
            "stale": 0,
            "unknown": 0
          },
          "reason": "no required evidence assesses this dimension",
          "rule": "required checks only; precedence is fail, blocked, stale, unknown, partial, pass, not_applicable; no numeric score",
          "status": "unknown"
        },
        "maturity": {
          "check_ids": [],
          "counts": {
            "blocked": 0,
            "fail": 0,
            "not_applicable": 0,
            "partial": 0,
            "pass": 0,
            "stale": 0,
            "unknown": 0
          },
          "reason": "no required evidence assesses this dimension",
          "rule": "required checks only; precedence is fail, blocked, stale, unknown, partial, pass, not_applicable; no numeric score",
          "status": "unknown"
        }
      },
      "declared": {
        "lifecycle": "active",
        "maturity": "active",
        "source": "Hygiene repository catalog"
      },
      "evidence": {
        "check_count": 0,
        "checks": [],
        "earliest_observed_at": null,
        "freshness": "unknown",
        "latest_observed_at": null,
        "producers": [],
        "record_count": 0,
        "represented_commits": []
      },
      "repository": {
        "full_name": "egohygiene/aether",
        "name": "aether",
        "plane": "architecture-control",
        "url": "https://github.com/egohygiene/aether",
        "visibility": "public"
      }
    },
    {
      "assessment": {
        "conformance": {
          "check_ids": [],
          "counts": {
            "blocked": 0,
            "fail": 0,
            "not_applicable": 0,
            "partial": 0,
            "pass": 0,
            "stale": 0,
            "unknown": 0
          },
          "reason": "no required evidence assesses this dimension",
          "rule": "required checks only; precedence is fail, blocked, stale, unknown, partial, pass, not_applicable; no numeric score",
          "status": "unknown"
        },
        "maturity": {
          "check_ids": [],
          "counts": {
            "blocked": 0,
            "fail": 0,
            "not_applicable": 0,
            "partial": 0,
            "pass": 0,
            "stale": 0,
            "unknown": 0
          },
          "reason": "no required evidence assesses this dimension",
          "rule": "required checks only; precedence is fail, blocked, stale, unknown, partial, pass, not_applicable; no numeric score",
          "status": "unknown"
        }
      },
      "declared": {
        "lifecycle": "active",
        "maturity": "active",
        "source": "Hygiene repository catalog"
      },
      "evidence": {
        "check_count": 0,
        "checks": [],
        "earliest_observed_at": null,
        "freshness": "unknown",
        "latest_observed_at": null,
        "producers": [],
        "record_count": 0,
        "represented_commits": []
      },
      "repository": {
        "full_name": "egohygiene/akashic",
        "name": "akashic",
        "plane": "knowledge-research",
        "url": "https://github.com/egohygiene/akashic",
        "visibility": "public"
      }
    },
    {
      "assessment": {
        "conformance": {
          "check_ids": [],
          "counts": {
            "blocked": 0,
            "fail": 0,
            "not_applicable": 0,
            "partial": 0,
            "pass": 0,
            "stale": 0,
            "unknown": 0
          },
          "reason": "no required evidence assesses this dimension",
          "rule": "required checks only; precedence is fail, blocked, stale, unknown, partial, pass, not_applicable; no numeric score",
          "status": "unknown"
        },
        "maturity": {
          "check_ids": [],
          "counts": {
            "blocked": 0,
            "fail": 0,
            "not_applicable": 0,
            "partial": 0,
            "pass": 0,
            "stale": 0,
            "unknown": 0
          },
          "reason": "no required evidence assesses this dimension",
          "rule": "required checks only; precedence is fail, blocked, stale, unknown, partial, pass, not_applicable; no numeric score",
          "status": "unknown"
        }
      },
      "declared": {
        "lifecycle": "active",
        "maturity": "active",
        "source": "Hygiene repository catalog"
      },
      "evidence": {
        "check_count": 0,
        "checks": [],
        "earliest_observed_at": null,
        "freshness": "unknown",
        "latest_observed_at": null,
        "producers": [],
        "record_count": 0,
        "represented_commits": []
      },
      "repository": {
        "full_name": "egohygiene/aniflow",
        "name": "aniflow",
        "plane": "content-publishing",
        "url": "https://github.com/egohygiene/aniflow",
        "visibility": "public"
      }
    },
    {
      "assessment": {
        "conformance": {
          "check_ids": [],
          "counts": {
            "blocked": 0,
            "fail": 0,
            "not_applicable": 0,
            "partial": 0,
            "pass": 0,
            "stale": 0,
            "unknown": 0
          },
          "reason": "no required evidence assesses this dimension",
          "rule": "required checks only; precedence is fail, blocked, stale, unknown, partial, pass, not_applicable; no numeric score",
          "status": "unknown"
        },
        "maturity": {
          "check_ids": [],
          "counts": {
            "blocked": 0,
            "fail": 0,
            "not_applicable": 0,
            "partial": 0,
            "pass": 0,
            "stale": 0,
            "unknown": 0
          },
          "reason": "no required evidence assesses this dimension",
          "rule": "required checks only; precedence is fail, blocked, stale, unknown, partial, pass, not_applicable; no numeric score",
          "status": "unknown"
        }
      },
      "declared": {
        "lifecycle": "active",
        "maturity": "active-collection",
        "source": "Hygiene repository catalog"
      },
      "evidence": {
        "check_count": 0,
        "checks": [],
        "earliest_observed_at": null,
        "freshness": "unknown",
        "latest_observed_at": null,
        "producers": [],
        "record_count": 0,
        "represented_commits": []
      },
      "repository": {
        "full_name": "egohygiene/athena",
        "name": "athena",
        "plane": "knowledge-research",
        "url": "https://github.com/egohygiene/athena",
        "visibility": "public"
      }
    },
    {
      "assessment": {
        "conformance": {
          "check_ids": [],
          "counts": {
            "blocked": 0,
            "fail": 0,
            "not_applicable": 0,
            "partial": 0,
            "pass": 0,
            "stale": 0,
            "unknown": 0
          },
          "reason": "no required evidence assesses this dimension",
          "rule": "required checks only; precedence is fail, blocked, stale, unknown, partial, pass, not_applicable; no numeric score",
          "status": "unknown"
        },
        "maturity": {
          "check_ids": [],
          "counts": {
            "blocked": 0,
            "fail": 0,
            "not_applicable": 0,
            "partial": 0,
            "pass": 0,
            "stale": 0,
            "unknown": 0
          },
          "reason": "no required evidence assesses this dimension",
          "rule": "required checks only; precedence is fail, blocked, stale, unknown, partial, pass, not_applicable; no numeric score",
          "status": "unknown"
        }
      },
      "declared": {
        "lifecycle": "seed",
        "maturity": "seed",
        "source": "Hygiene repository catalog"
      },
      "evidence": {
        "check_count": 0,
        "checks": [],